{
    "$schema": "http://json-schema.org/draft-07/schema#",
    "type": "object",
    "required": ["id", "ingredients", "glassType", "tags"],
    "properties": {
        "id": {
            "type": "string",
            "pattern": "^[a-zA-Z0-9]+$",
            "description": "Unique identifier for the cocktail"
        },
        "image": {
            "type": "string",
            "pattern": "^[a-zA-Z0-9]+\\.png$",
            "description": "Name of the cocktail image file"
        },
        "ingredients": {
            "type": "array",
            "items": {
                "type": "object",
                "required": ["name", "amount", "unit"],
                "properties": {
                    "name": {
                        "type": "string",
                        "pattern": "^[a-zA-Z0-9]+$",
                        "description": "Ingredient identifier"
                    },
                    "amount": {
                        "type": "number",
                        "description": "Amount of the ingredient"
                    },
                    "unit": {
                        "type": "string",
                        "enum": ["ml", "cl", "dash", "leaves", "whole", "piece", "pinch"],
                        "description": "Unit of measurement"
                    }
                }
            }
        },
        "glassType": {
            "type": "string",
            "enum": ["highball", "tumbler", "martini", "cocktailCoupe", "hurricane", "mug", "wine"],
            "description": "Type of glass used for the cocktail"
        },
        "tags": {
            "type": "object",
            "required": ["flavorTags", "spiritTags"],
            "properties": {
                "flavorTags": {
                    "type": "array",
                    "items": {
                        "type": "string",
                        "enum": ["fruity", "sour", "bitter", "sweet", "spicy"]
                    },
                    "description": "Tags describing the flavor profile"
                },
                "spiritTags": {
                    "type": "array",
                    "items": {
                        "type": "string",
                        "enum": ["rum", "vodka", "gin", "tequila", "whiskey", "virgin"]
                    },
                    "description": "Tags indicating the primary spirits used"
                }
            },
            "description": "Tags for categorizing and filtering cocktails"
        }
    }
}
