{
    "id": "mojito",
    "image": "mojito.png",
    "ingredients": [
        {
            "name": "whiteRum",
            "amount": 60,
            "unit": "ml"
        },
        {
            "name": "limeJuice",
            "amount": 30,
            "unit": "ml"
        },
        {
            "name": "simpleSyrup",
            "amount": 22.5,
            "unit": "ml"
        },
        {
            "name": "mintLeaves",
            "amount": 8,
            "unit": "leaves"
        },
        {
            "name": "clubSoda",
            "amount": 60,
            "unit": "ml"
        }
    ],
    "glassType": "highball",
    "tags": {
        "flavorTags": ["sour", "sweet"],
        "spiritTags": ["rum"]
    }
}
