{
    "id": "paloma",
    "image": "paloma.png",
    "ingredients": [
        {
            "name": "tequila",
            "amount": 60,
            "unit": "ml"
        },
        {
            "name": "grapefruitSoda",
            "amount": 120,
            "unit": "ml"
        },
        {
            "name": "limeJuice",
            "amount": 15,
            "unit": "ml"
        },
        {
            "name": "salt",
            "amount": 1,
            "unit": "pinch"
        }
    ],
    "glassType": "highball",
    "tags": {
        "flavorTags": ["sour", "bitter"],
        "spiritTags": ["tequila"]
    }
}
