{
    "id": "tomCollins",
    "image": "tomCollins.png",
    "ingredients": [
        {
            "name": "gin",
            "amount": 60,
            "unit": "ml"
        },
        {
            "name": "lemonJuice",
            "amount": 30,
            "unit": "ml"
        },
        {
            "name": "simpleSyrup",
            "amount": 15,
            "unit": "ml"
        },
        {
            "name": "clubSoda",
            "amount": 90,
            "unit": "ml"
        }
    ],
    "glassType": "highball",
    "tags": {
        "flavorTags": ["sour", "sweet"],
        "spiritTags": ["gin"]
    }
}
