{
    "id": "bloodyMary",
    "image": "bloodyMary.png",
    "ingredients": [
        {
            "name": "vodka",
            "amount": 45,
            "unit": "ml"
        },
        {
            "name": "tomatoJuice",
            "amount": 90,
            "unit": "ml"
        },
        {
            "name": "lemonJuice",
            "amount": 15,
            "unit": "ml"
        },
        {
            "name": "worcestershireSauce",
            "amount": 2,
            "unit": "dash"
        },
        {
            "name": "tabascoSauce",
            "amount": 2,
            "unit": "dash"
        },
        {
            "name": "salt",
            "amount": 1,
            "unit": "pinch"
        },
        {
            "name": "blackPepper",
            "amount": 1,
            "unit": "pinch"
        },
        {
            "name": "celeryStick",
            "amount": 1,
            "unit": "piece"
        }
    ],
    "glassType": "highball",
    "tags": {
        "flavorTags": ["spicy", "sour"],
        "spiritTags": ["vodka"]
    }
}
