{
    "id": "caipirinha",
    "image": "caipirinha.png",
    "ingredients": [
        {
            "name": "cachaca",
            "amount": 60,
            "unit": "ml"
        },
        {
            "name": "limeWedges",
            "amount": 8,
            "unit": "piece"
        },
        {
            "name": "sugarCubes",
            "amount": 2,
            "unit": "piece"
        }
    ],
    "glassType": "tumbler",
    "tags": {
        "flavorTags": ["sour", "sweet"],
        "spiritTags": ["rum"]
    }
}
