{
    "id": "oldFashioned",
    "image": "oldFashioned.png",
    "ingredients": [
        {
            "name": "bourbonWhiskey",
            "amount": 60,
            "unit": "ml"
        },
        {
            "name": "simpleSyrup",
            "amount": 7.5,
            "unit": "ml"
        },
        {
            "name": "angosturaBitters",
            "amount": 2,
            "unit": "dash"
        },
        {
            "name": "orangePeel",
            "amount": 1,
            "unit": "piece"
        }
    ],
    "glassType": "tumbler",
    "tags": {
        "flavorTags": ["bitter", "sweet"],
        "spiritTags": ["whiskey"]
    }
}
