{
    "id": "moscowMule",
    "image": "moscowMule.png",
    "ingredients": [
        {
            "name": "vodka",
            "amount": 60,
            "unit": "ml"
        },
        {
            "name": "limeJuice",
            "amount": 15,
            "unit": "ml"
        },
        {
            "name": "gingerBeer",
            "amount": 120,
            "unit": "ml"
        }
    ],
    "glassType": "mug",
    "tags": {
        "flavorTags": ["sour", "spicy"],
        "spiritTags": ["vodka"]
    }
}
