{
    "id": "darkNStormy",
    "image": "darkNStormy.png",
    "ingredients": [
        {
            "name": "darkRum",
            "amount": 60,
            "unit": "ml"
        },
        {
            "name": "gingerBeer",
            "amount": 120,
            "unit": "ml"
        },
        {
            "name": "limeJuice",
            "amount": 15,
            "unit": "ml"
        }
    ],
    "glassType": "highball",
    "tags": {
        "flavorTags": ["spicy", "sweet"],
        "spiritTags": ["rum"]
    }
}
